pertanyaan,Kategori
bagaimana kisah tentang mukasyafah nya sayyidina ali r.a tentang sayyidina umar vs mungkar nakir,KISAH SAYYIDINA UMAR VS MALAIKAT MUNKAR-NAKIR
ceritakan kisah sayyidina umar vs munkar nakir,KISAH SAYYIDINA UMAR VS MALAIKAT MUNKAR-NAKIR
cerita sayyidina umar vs munkar nakir termaktub dari kitab apa?,KISAH SAYYIDINA UMAR VS MALAIKAT MUNKAR-NAKIR
kenapa wudhu menggunakan air?,ALASAN BERSUCI DENGAN AIR
apakah bisa wudhu tidak menggunakan air?,ALASAN BERSUCI DENGAN AIR
kalau tidak ada air bagaimana bisa berwuduhu?,ALASAN BERSUCI DENGAN AIR
wudhu tanpa air,ALASAN BERSUCI DENGAN AIR
mengapa wuduh harus menggunakan air?,ALASAN BERSUCI DENGAN AIR
haruskah wudhu pake air?,ALASAN BERSUCI DENGAN AIR
kenapa sholat maghrib 3 rokaat. Ashar 4 Zhuhur 4 Subuh 2 roka'at. Kok tidak disamakan saja,ALASAN BERSUCI DENGAN AIR
mengapa jumlah rakaat sholat beragam,ALASAN BERSUCI DENGAN AIR
mengapa jumlah rakaat sholat berbeda-beda,ALASAN BERSUCI DENGAN AIR
mengapa jumlah rakaat sholat tidak sama,ALASAN BERSUCI DENGAN AIR
kenapa sholat maghrib 3 rakaat,ALASAN BERSUCI DENGAN AIR
mengapa sholat dzuhur ashar dan isya 4 rakaat,ALASAN BERSUCI DENGAN AIR
kenapa sholat subuh 2 rakaat,ALASAN BERSUCI DENGAN AIR
bolehkah mahar nikah berasal dari orang lain?,MAHAR NIKAH BERASAL DARI ORANG LAIN
calon suami mendapat sponsor untuk dijadikan mahar nikah seperti pada acara tv,MAHAR NIKAH BERASAL DARI ORANG LAIN
apakah mahar harus dari calon suami saja?,MAHAR NIKAH BERASAL DARI ORANG LAIN
calon suami memberi mahar nikah dari sponsor,MAHAR NIKAH BERASAL DARI ORANG LAIN
calon suami memberi mahar nikah dari pemberian orang lain,MAHAR NIKAH BERASAL DARI ORANG LAIN
hukum laki-laki memakai kalung tasbih,HUKUM LELAKI MEMAKAI KALUNG TASBIH
apakah laki-laki boleh memakai kalung tasbih,HUKUM LELAKI MEMAKAI KALUNG TASBIH
bolehkah memakai kaling tasbih,HUKUM LELAKI MEMAKAI KALUNG TASBIH
apa arti mimipi jika masjid jami' dibongkar,TAFSIR MIMPI MASJID ROBOH
mengapa mimpi saya masjid jami' dibongkar sehingga sholat jum'at dipindah ke masjid,TAFSIR MIMPI MASJID ROBOH
apa maksud dari mimpi masjid yang roboh,TAFSIR MIMPI MASJID ROBOH
tafsirkan mimpi dari mimpi masjid yang roboh,TAFSIR MIMPI MASJID ROBOH
tafsir mimpi masjid yang di bongkar,TAFSIR MIMPI MASJID ROBOH
apakah boleh bercumbu dengan istri ketika istri sedang haid,BOLEHKAH SUAMI MENGELUARKAN MANI SAAT BERCUMBU DENGAN ISTRI YANG HAID ?
bercumbu dengan istri selain di sekitar pusar dan lutut,BOLEHKAH SUAMI MENGELUARKAN MANI SAAT BERCUMBU DENGAN ISTRI YANG HAID ?
apakah boleh mengeluarkan air mani ketika bercumbu dengan istri tanpa jimak,BOLEHKAH SUAMI MENGELUARKAN MANI SAAT BERCUMBU DENGAN ISTRI YANG HAID ?
"Apakah disunahkan bagi makmum membaca lafadz ""Alaihima assalamu"" ketika imam membaca ayat dari surat al-A'la yang berbunyi ""Suhufi Ibrohima wa Musa""",HUKUM MEMBACA DO?A DI TENGAH SHOLAT
apakah boleh membaca doa ditengah-tengah membaca al-Qur'an saat sholat?,HUKUM MEMBACA DO?A DI TENGAH SHOLAT
apakah sah sholat jika baca doa di saat membaca surat ditengah-tengah sholat?,HUKUM MEMBACA DO?A DI TENGAH SHOLAT
apakah boleh menjima istri ketika sedang menyusui?,HUKUM MELAKUKAN HUBUNGAN INTIM PADA MASA MENYUSUI
apakah akan berpengaruh pada bayi jika menjima istri ketika masa menyusui?,HUKUM MELAKUKAN HUBUNGAN INTIM PADA MASA MENYUSUI
bisakah berhubungan dengan istri ketika sedang tahap menyusui bayi?,HUKUM MELAKUKAN HUBUNGAN INTIM PADA MASA MENYUSUI
apakah boleh menjual knalpot racing?,HUKUM JUAL BELI KNALPOT RACING
halalkah menjual knalpot untuk balapan?,HUKUM JUAL BELI KNALPOT RACING
bagaimana jika menjual knalpot racing atau balapan?,HUKUM JUAL BELI KNALPOT RACING
apakah boleh berqurban dengan ayam jago?,HUKUM BERQURBAN DENGAN AYAM JAGO
bolehkah qurban selain dengan sapi kambing domba unta?,HUKUM BERQURBAN DENGAN AYAM JAGO
hewan apa yang diperbolehkan untuk qurban?,HUKUM BERQURBAN DENGAN AYAM JAGO
bagaimana jika tidak mampu berqurban dengan kambing domba sapi atau unta?,HUKUM BERQURBAN DENGAN AYAM JAGO
Hukum mad lazim harfi musyaba' mutsaqqol dan mukhoffaf itu perhuruf dibaca sama panjangnya atau hanya yang termasuk huruf mad lazim harfi musyaba' mutsaqqol saja yang panjang 6 harkat ?,TAJWID : MAD LAZIM HARFI MUSYABBA?
bagaimana hukum tajwid Mad lazim harfi musyabba',TAJWID : MAD LAZIM HARFI MUSYABBA?
bagaimana cara membaca huruf Mad lazim harfi musyabba',TAJWID : MAD LAZIM HARFI MUSYABBA?
bagaimana hukum tajwid Mad lazim harfi mukhaffaf,TAJWID : MAD LAZIM HARFI MUSYABBA?
bagaimana cara membaca huruf Mad lazim harfi mukhaffaf,TAJWID : MAD LAZIM HARFI MUSYABBA?
jika baju atau tangan basah kena najis kering apakah ikut kena najis juga atau tidak?,NAJASAH : BASAH YANG MENAJISKAN
batasan mana yang dapat menularkan najis?,NAJASAH : BASAH YANG MENAJISKAN
apakah lembab atau basah karena keringat dapat menularkan najis?,NAJASAH : BASAH YANG MENAJISKAN
apakah ketika melaksanakan sunnah di tengah sholat harus diniatkan?,HARUSKAH BERNIAT KETIKA MELAKSANAKAN SUNNAH-SUNNAH SHOLAT ?
jika melakukan sunnah saat sholat haruskah diniatkan dalam hati?,HARUSKAH BERNIAT KETIKA MELAKSANAKAN SUNNAH-SUNNAH SHOLAT ?
apakah sebelum sholat harus membaca bismillah?,SHOLAT : HUKUM BACA BASMALAH SAAT AKAN SHOLAT
apakah sebelum sholat harus membaca basmalah?,SHOLAT : HUKUM BACA BASMALAH SAAT AKAN SHOLAT
bagaimana hukum membaca bismillah/basmalah sebelum sholat?,SHOLAT : HUKUM BACA BASMALAH SAAT AKAN SHOLAT
kenapa membaca bismillah sebelum sholat tidak di sunnahkan?,SHOLAT : HUKUM BACA BASMALAH SAAT AKAN SHOLAT
jika imam sholat terlalu cepat hingga ketinggalan rukuknya apakah mendapat rokaat imam?,JIKA MAKMUM KETINGGALAN BACA FATIHAH KARENA IMAM SHOLAT TERLALU CEPAT
makmum ketinggalan rukuknya imam yang terlalu cepat,JIKA MAKMUM KETINGGALAN BACA FATIHAH KARENA IMAM SHOLAT TERLALU CEPAT
berapa batasan makmum mendapat rokaat sholat jama'ah,JIKA MAKMUM KETINGGALAN BACA FATIHAH KARENA IMAM SHOLAT TERLALU CEPAT
bagaimana jika belum selesai membaca al-fatihah namun imam sudah rukuk,JIKA MAKMUM KETINGGALAN BACA FATIHAH KARENA IMAM SHOLAT TERLALU CEPAT
berapa batasan washiat?,WASHIAT : BATASAN MAKSIMAL WASHIAT
berapa batasan wasiat,WASHIAT : BATASAN MAKSIMAL WASHIAT
bagaimana hukum pembagian wasiat,WASHIAT : BATASAN MAKSIMAL WASHIAT
Siapakah istrinya sayyidina Abu Bakar Ash-Shidiq RA dan para putranya,SEJARAH NAMA ISTRI DAN PUTRA PUTRI SAYYIDINA ABU BAKAR ASH-SHIDIQ
siapa saja istri Abu Bakar Ash-Shidiq RA,SEJARAH NAMA ISTRI DAN PUTRA PUTRI SAYYIDINA ABU BAKAR ASH-SHIDIQ
siapa saja anak Abu Bakar Ash-Shidiq RA,SEJARAH NAMA ISTRI DAN PUTRA PUTRI SAYYIDINA ABU BAKAR ASH-SHIDIQ
bagaimana hadits tentang meludah kearah kiblat,HUKUM MELUDAH KE ARAH KIBLAT
bagaimana hukumnya meludah ke arah kiblat,HUKUM MELUDAH KE ARAH KIBLAT
apakah benar hadits tentang meludah ke arah kiblat,HUKUM MELUDAH KE ARAH KIBLAT
jika meludah kearah kiblat maka ludah tersebut akan menempel di muka saat hari kiamat apakah hadits tersebut benar,HUKUM MELUDAH KE ARAH KIBLAT
bagaimana hukum jual beli kucing,HUKUM JUAL BELI KUCING
apakah boleh membeli kucing,HUKUM JUAL BELI KUCING
apakah boleh menjual kucing,HUKUM JUAL BELI KUCING
apakah boleh membeli kucing rumahan,HUKUM JUAL BELI KUCING
apakah boleh menaruh alquran di jok motor,HUKUM MENARUH MUSHAF AL-QUR'AN ATAU KITAB DI JOK (BAGASI) MOTOR
jika hujan lalu menaruh mushaf al-qur'an di jok motor,HUKUM MENARUH MUSHAF AL-QUR'AN ATAU KITAB DI JOK (BAGASI) MOTOR
dalam keadaan darurat apakah boleh menyimpan al-qur'an di jok motor,HUKUM MENARUH MUSHAF AL-QUR'AN ATAU KITAB DI JOK (BAGASI) MOTOR
apakah boleh memakan daging dari sembelihan orang non muslim,HUKUM SEMBELIHAN NON MUSLIM
bagaimana hukum menyembelih hewan,HUKUM SEMBELIHAN NON MUSLIM
hukum memakan daging dari sembelihan orang non-muslim,HUKUM SEMBELIHAN NON MUSLIM
apakah boleh istri menggugat cerai suami yang di penjara,HUKUM ISTRI GUGAT CERAI SUAMI YANG DIPENJARA
bagaimana hukumnya jika istri menggugat cerai suami yang sedang di penjara,HUKUM ISTRI GUGAT CERAI SUAMI YANG DIPENJARA
batas waktu istri diperbolehkan menggugat cerai suami jika suami tidak memberi nafkah,HUKUM ISTRI GUGAT CERAI SUAMI YANG DIPENJARA
apa arti mimpi melihat langit,TAFSIR MIMPI MELIHAT LANGIT
bagaimana tafsir mimpi melihat langit,TAFSIR MIMPI MELIHAT LANGIT
jika bermimpi melihat langit apa artinya?,TAFSIR MIMPI MELIHAT LANGIT
bagaimana hukum dan kedudukan anak tiri dalam hak waris,anak tiri bukan ahli waris
apakah anak tiri tergolong ahli waris,anak tiri bukan ahli waris
kenapa anak tiri tidak tergolong ahli waris,anak tiri bukan ahli waris
bagaimana hukum penggunaan kapas pada lubang 9 pada mayat,menutup lubang sembilan pada mayit
dimana saja penggunaan kapas pada lubang 9 pada mayat,menutup lubang sembilan pada mayit
bagaimana hukum membaca hadits menggunakan tajwid,membaca hadits menggunakan tajwid
apakah boleh membaca hadits dengan tajwid,membaca hadits menggunakan tajwid
apakah tidak apa-apa jika mengerjakan sholat qobliyah shubuh setelah sholat fardhu,hukum sholat qobliyah shubuh setelah shalat shubuh
kapan waktu yang tepat melaksanakan sholat qobliyah shubuh,hukum sholat qobliyah shubuh setelah shalat shubuh
bagaimana hukum sholat qobliyah shubuh setelah shalat shubuh,hukum sholat qobliyah shubuh setelah shalat shubuh
apakah ada ta'bir yang memperbolehkan mengqodho' sholat sunnah fajar dikerjakan ba'da sholat subuh,hukum sholat qobliyah shubuh setelah shalat shubuh
wa ana awalul muslimin pada doa iftitah,perihal kalimat wa ana minal muslimin dalam doa iftitah sholat
dalam doa iftitah mengapa kita membaca ?wabizdalika umirtu wa ana minal muslimin? bukan ?wa bidzalika umirtu wa ana awalul muslimin?,perihal kalimat wa ana minal muslimin dalam doa iftitah sholat
semisal ibu mengajak saya untuk mengantarkannya berbelanja sedangkan waktu shalat wajib 10 menit lagi apa yang harus saya lakukan?,keluarga: mendahulukan perintah orang tua
apakah boleh saya mendahulukan sholat daripada perintah orang tua?,keluarga: mendahulukan perintah orang tua
buaya dan kodok apakah semuanya haram atau bagaimana,hukum makan daging katak dan buaya
bagaimana hukum makan katak dan buaya,hukum makan daging katak dan buaya
kenapa kita ga boleh makan katak dan buaya,hukum makan daging katak dan buaya
bagaimana jika telah sahur tapi belum pasang niat puasa ramadhan,apakah makan sahur mencukupi sebagai niat puasa
apakah sahur saja sudah mewakili niat berpuasa,apakah makan sahur mencukupi sebagai niat puasa
bagaimana kalau kasusnya pernikahan yang dasarnya saja sudah tidak sah (cacat) seperti contoh menikah dengan wanita non muslim (harby) tapi kemudian cerai lalu si ibu mertua muallaf lalu menantu tadi menyukai dan menikahi mertuanya sendiri?,munakahat: hukum menikahi ibu dari istri yang tidak sah akad nikahnya
apakah hukum menikahi ibu dari istri yang tidak sah akad nikahnya,munakahat: hukum menikahi ibu dari istri yang tidak sah akad nikahnya
qurban setelah hari tasyrik,adakah qoul yang membolehkan qurban setelah hari tasyrik?
qaul yang membolehkan menyembelih qurban keluar dari hari nahr dan hari tasyriq,adakah qoul yang membolehkan qurban setelah hari tasyrik?
waktu yang diperbolehkan untuk menyembelih qurban,adakah qoul yang membolehkan qurban setelah hari tasyrik?
bagaimana hukum kesucian air dalam ember yang dialiri air keran,status hukum kesucian air dalam ember yang dialiri air keran
wudhu dengan air dalam ember yang dijadikan bak yang mengocor dari keran,status hukum kesucian air dalam ember yang dialiri air keran
bagaimana hukum mengumandangkan azan dalam keadaan duduk,hukum mengumandangkan azan dalam keadaan duduk
bolehkah mengumandangkan azan sambil duduk,hukum mengumandangkan azan dalam keadaan duduk
mengapa muazin selalu berdiri saat mengumandangkan azan,hukum mengumandangkan azan dalam keadaan duduk
apa itu dosa,inilah definisi dan ta'rif dosa menurut kitab kuning
pengertian dosa,inilah definisi dan ta'rif dosa menurut kitab kuning
definisi dan ta'rif dosa menurut kitab kuning,inilah definisi dan ta'rif dosa menurut kitab kuning
apakah ada batasan umur anak yang wajib dikontrol oleh ortunya,HUKUM BERBUAT DOSA BAGI ANAK YANG BELUM BALIGH II
kriteria anak yang wajib dikontrol oleh ortunya,HUKUM BERBUAT DOSA BAGI ANAK YANG BELUM BALIGH II
apakah dosa anak yang belum baligh maupun sudah baligh ditanggung oleh ortunya,HUKUM BERBUAT DOSA BAGI ANAK YANG BELUM BALIGH II
kewajiban orang tua mendidik anak sebelum baligh,HUKUM BERBUAT DOSA BAGI ANAK YANG BELUM BALIGH II
apakah dalam syar'i diperbolehkan seorang ayah membawa kembali anak wanita dari suaminya,SYARAT-SYARAT ISTRI BOLEH MENGAJUKAN FASAKH NIKAH II
solusi jika melihat anak wanita didzolimi oleh suaminya,SYARAT-SYARAT ISTRI BOLEH MENGAJUKAN FASAKH NIKAH II
hukum membaca sholawat ketika akan makan,HUKUM MEMBACA SHOLAWAT KETIKA AKAN / SEDANG MAKAN
hukum membaca sholawat ketika saat makan,HUKUM MEMBACA SHOLAWAT KETIKA AKAN / SEDANG MAKAN
membaca sholawat ketika akan/saat makan termasuk bid'ah,HUKUM MEMBACA SHOLAWAT KETIKA AKAN / SEDANG MAKAN
cara pembuatan mubtada dari isim nakirah,DALAM NAHWU ADAKAH MUBTADA BERUPA ISIM NAKIROH?
apakah boleh menggunakan mubtada dengan isim nakirah,DALAM NAHWU ADAKAH MUBTADA BERUPA ISIM NAKIROH?
adakah mubtada berupa isim nakirah,DALAM NAHWU ADAKAH MUBTADA BERUPA ISIM NAKIROH?
bagaimanakah bunyi hadits dari : ?Dua kebahagiaan bagi orang yang shaum?,PUASA : DUA KEBAHAGIAN BAGI ORANG YANG BERPUASA
apa saja kebahagiaan bagi orang yang berpuasa,PUASA : DUA KEBAHAGIAN BAGI ORANG YANG BERPUASA
kebahagiaan berpuasa,PUASA : DUA KEBAHAGIAN BAGI ORANG YANG BERPUASA
hukum berobat dalam islam,INILAH RINCIAN HUKUM BEROBAT MENURUT ISLAM
apa beda thurob dan ghubar,Thoharoh : Perbedaan Thurob dan Ghubar
perbedaan thurob dan ghubar,Thoharoh : Perbedaan Thurob dan Ghubar
thurob dan ghubar,Thoharoh : Perbedaan Thurob dan Ghubar
silaturrahmi,FADHILAH DAN KEUTAMAAN SILATURRAHIM
fadhilah dan keutamaan silaturrahmi,FADHILAH DAN KEUTAMAAN SILATURRAHIM
silaturrahmi kunci pembuka rizki,FADHILAH DAN KEUTAMAAN SILATURRAHIM
bagaimana hukum menyentuh kemaluan istri saat berpuasa,HUKUM SAAT PUASA MENYENTUH KEMALUAN ISTRI
apakah boleh saat berpuasa menyentuh kemaluan istri,HUKUM SAAT PUASA MENYENTUH KEMALUAN ISTRI
menyentuh kemaluan istri saat berpuasa,HUKUM SAAT PUASA MENYENTUH KEMALUAN ISTRI
makna za'faron,HUKUM LAKI-LAKI MEMAKAI MINYAK ZA?FARON
apa itu za'faron,HUKUM LAKI-LAKI MEMAKAI MINYAK ZA?FARON
bagaimana hukum laki-laki memakai za'faron,HUKUM LAKI-LAKI MEMAKAI MINYAK ZA?FARON
apakah boleh laki-laki memakai za'faron,HUKUM LAKI-LAKI MEMAKAI MINYAK ZA?FARON
apakah perbedaan al-wahid dan al-ahad,ASMAUL HUSNA : INILAH PERBEDAAN AL-WAHID DAN AL-AHAD
beda antara al-wahid dan al-ahad,ASMAUL HUSNA : INILAH PERBEDAAN AL-WAHID DAN AL-AHAD
al-wahid dan al-ahad,ASMAUL HUSNA : INILAH PERBEDAAN AL-WAHID DAN AL-AHAD
Apakah thalak harus ada saksi?,Thalak tidak harus ada saksi
Apakah boleh melakukan thalak dengan adanya saksi?,Thalak tidak harus ada saksi
Kenapa Al-quran disebutkan sebagai Al kitab?,Alquran adalah Alkitab
Apakah Alkitab sama dengan Al-quran?,Alquran adalah Alkitab
Apa bedanya Alquran dan Alkitab?,Alquran adalah Alkitab
Apakah hukum menggantikan lafaz Muhammad dengan Ahmad pada syahadat pada muallaf,Tidak sah menggantikan lafaz pada syahadat
Bagaimana jika mengubah kata Muhammad menjadi Ahmad pada syahadat?,Tidak sah menggantikan lafaz pada syahadat
Apakah boleh menggantikan Lafaz Muhammad dengan Ahmad pada syahadat?,Tidak sah menggantikan lafaz pada syahadat
Berapakah jarak antara Imam dan Makmum ketika shalat?,Jarak 300 hasta 301 masih di tolerir
Apakah boleh jarak antara imam dan makmum lebih sedikit dengan yg sudah ditentukan?,Jarak 300 hasta 301 masih di tolerir
Apakah harus ada jarak antara Imam dan makmum ketika shalat?,Jarak 300 hasta 301 masih di tolerir
Apa saja yang membuat makruh ketika shalat?,Yang membuat makruh pada shalat
Apakah boleh shalat dengan meminta agar harta selalu terjaga,Yang membuat makruh pada shalat yaitu
Adakah hal yang membuat makruh ketika shalat?,Yang membuat makruh pada shalat yaitu
Apa yang dimaksud dengan bakhil?,bakhil/pelit tidak masuk surga
Salah satu sifat yang membuat manusia tidak masuk surga,bakhil/pelit tidak masuk surga
Apakah hukuman bagi orang yang bakhil atau pelit dalam mengeluarkan zakat atau sedekah,bakhil/pelit tidak masuk surga
Apakah wajib memperhatikan tata cara zikir ketika selesai shalat?,dalil posisi duduk saat zikir ba'da shalat maktubah
Bagaimana posisi yang baik ketika ingin membacakan dzikir ba'da shalat?,dalil posisi duduk saat zikir ba'da shalat maktubah
Apakah boleh zikir ba'da shalat tanpa mempelajari posisi duduk saat zikir?,dalil posisi duduk saat zikir ba'da shalat maktubah
Apa bedanya antara kalimat Rabb dan Illah?,Perbedaan kalimat Rabb dan Illah
Apakah Rabb dan Illah itu sama?,Perbedaan kalimat Rabb dan Illah
Bagaimana membedakan antara Rabb dan Illah?,Perbedaan kalimat Rabb dan Illah
Apakah pernah malaikat Jibril meruqyah Nabi Muhammad SAW akibat terkena sihir?,Hadist Malaikat Jibril meruqyah Nabi Muhammad SAW
Malaikat apa yang meruqyah nabi Muhamad SAW ketika terkena sihir?,Hadist Malaikat Jibril meruqyah Nabi Muhammad SAW
Apa yang menyebabkan malaikat jibril sampai meruqyah Nabi Muhammad SAW?,Hadist Malaikat Jibril meruqyah Nabi Muhammad SAW
Kepada siapakah ahli waris diberikan jika pemilik tidak memiliki keluarga?,Jika ahli waris tidak ada
Apakah boleh anak tiri mendapatkan ahli waris ?,Jika ahli waris tidak ada
Bagaimana pembagian waris jika yang ttersisa hanya anak tiri,Jika ahli waris tidak ada
Bolehkan jika thr dijadikan zakat?,Hukum memberikan THR tapi jadikan Zakat
Bagaimana yang dikatakan sudah mencukupi (sah) sebagai zakat?,Hukum memberikan THR tapi jadikan Zakat
Apakah disebut zakat jika memberikannya pada sesama orang kaya?,Hukum memberikan THR tapi jadikan Zakat
Apakah hukum membaca hadist secara tartil?,Hukum membaca hadist dengan tartil
Apakah yang dimaksud tajwid pada membaca hadist?,Hukum membaca hadist dengan tartil
Apakah wajib membaca hadist dengan menggunakan tajwid?,Hukum membaca hadist dengan tartil
Apakah yang dimaksud dengan Al-arwah almuqoddasah?,Arwah Muqoddasah
Apakah orang-orang yang beramal shaleh disebut sebagai arwah muqoddasah?,Arwah Muqoddasah
Siapa sajakah yang disebut dengan Arwah Muqoddasah?,Arwah Muqoddasah
kenapa Allah bersumpah dengan kata demi masa?,Alasan sumpah dengan Al-Ashr
Surah apa yang berkaitan dengan demi masa sumpahnya Allah ?,Alasan sumpah dengan Al-Ashr
Apakah yang dimaksud orang yang merugi pada surah Al-Ashr?,Alasan sumpah dengan Al-Ashr
Apakah hukum bagi orang yang bernazar poligami?,Jika bernazar melakukan poligami
Apakah boleh seorang wanita muslim melakukan poliandri?,Jika bernazar melakukan poligami
Apakah bernazar poligami termasuk perbuatan maksiat(kedurhakaan)?,Jika bernazar melakukan poligami
Apakah hukum bagi orang yang melakukan onani?,Onani termasuk dosa besar atau kecil
Apa saja ciri-ciri orang yang tidak di rahmati Allah yaitu orang-orang yang masuk kedalam neraka,Onani termasuk dosa besar atau kecil
Apakah dosa besar bagi orang yang melakukan onani?,Onani termasuk dosa besar atau kecil
Bagaimanakah perhitungan pergantian waktu hari jumat dalam islam,perhitungan pergantian waktu dalam islam
Bagaimanakah pengertian awal bulan pada perhtiungan dalam islam?,perhitungan pergantian waktu dalam islam
Kapan disebut malam jumat pada perhitungan waktu dalam islam?,perhitungan pergantian waktu dalam islam
Apa saja tahapan-tahapan ilmu yg dimiliki seseorang?,Tiga tahapan ilmu
Apakah perbedaan waktu tiap negara mempengaruhi turunnya malam lailatul qadr?,waktu terjadinya lailatul qadr antar negara
Bagaimanakah cara mengetahui turunnya lailatul qadr antar negara?,waktu terjadinya lailatul qadr antar negara
Apakah malam lailatul qadr terjadi dua kali?,waktu terjadinya lailatul qadr antar negara
Dengan cara apa agar kita dapat salah satu pintu surga?,salah satu pintu surga adalah orang tua
Bagaimanakah cara agar kita dapat memproleh pintu surga?,salah satu pintu surga adalah orang tua
Apakah berbakti kepada orang tua kita akan memperoleh salah satu pintu surga?,salah satu pintu surga adalah orang tua
Bagaimanakah hukum air wafaq alquran dibuang ke tanah?,Hukum air wafaq Al-Quran dibuang ke tanah
Apakah itu air wafaq?,Hukum air wafaq Al-Quran dibuang ke tanah
Kapankah terjadi nya hari isra' mi'raj?,Hari terjdinya isra' dan mi'raj
sampai Kapan kah umur umat Islam akan bertahan?,umur umat islam sampai 1500 tahun
Apakah benar umur umat Islam sampai 1500 tahun?,umur umat islam sampai 1500 tahun
Apakah benar tafsiran hidup dunia kadarnya perhari adalah 50 ribu tahun?,umur umat islam sampai 1500 tahun
Bagaimanakah hukum transaksi jual beli ketika khutbah jumat berlangsung?,Hukum uang jual beli saat khutbah jumat berlangsung
Bagaimanakah hukum menjual pulsa yang mana pulsa tersebut digunakan untuk hal yang tidak bermanfaat(misal: telpon pacar),Hukum uang jual beli saat khutbah jumat berlangsung
Bagaimanakah hukum hasil uang penjualan ketika khutbah jumat berlangsung,Hukum uang jual beli saat khutbah jumat berlangsung
Bagaimana hukum makan sampai kekenyangan?,Hukum makan sampai kekenyangan
Apa boleh makan sampai kekenyangan?,Hukum makan sampai kekenyangan
Apakah ada hal lain yang memperbolehkan makan sampai kekenyangan?,Hukum makan sampai kekenyangan
